centre_id,centre_name,cleaned_postcode_candidate,cleaned_address_candidate,query_primary,query_secondary,query_tertiary,lookup_confidence,lookup_notes,lat,lng,resolution_status
ludlow,Ludlow,,Weeping Cross Lane,Ludlow driving test centre UK,Weeping Cross Lane Ludlow UK,Ludlow test centre UK,medium,"address_incomplete,no_postcode_found",,,pending
luton,Luton,,Frank Lester Way,Luton driving test centre UK,Frank Lester Way Luton UK,Luton test centre UK,medium,"address_incomplete,no_postcode_found",,,pending
macclesfield,Macclesfield,,Stamford Rd / Moss Lane,Macclesfield driving test centre UK,Stamford Rd / Moss Lane Macclesfield UK,Macclesfield test centre UK,medium,"address_incomplete,no_postcode_found",,,pending
mallaig,Mallaig,,Main Street / East Bay,Mallaig driving test centre UK,Main Street / East Bay Mallaig UK,Mallaig test centre UK,medium,"address_incomplete,no_postcode_found",,,pending
malton,Malton,,Hambleton Rd / Langley Drive,Malton driving test centre UK,Hambleton Rd / Langley Drive Malton UK,Malton test centre UK,medium,"address_incomplete,no_postcode_found",,,pending
melton_mowbray,Melton Mowbray,,Balmoral Drive / Dieppe Way,Melton Mowbray driving test centre UK,Balmoral Drive / Dieppe Way Melton Mowbray UK,Melton Mowbray test centre UK,medium,"address_incomplete,no_postcode_found",,,pending
merthyr_tydfil,Merthyr Tydfil,,St Annes Close,Merthyr Tydfil driving test centre UK,St Annes Close Merthyr Tydfil UK,Merthyr Tydfil test centre UK,medium,"address_incomplete,no_postcode_found",,,pending
middlesbrough,Middlesbrough,,Cargo Fleet Lane,Middlesbrough driving test centre UK,Cargo Fleet Lane Middlesbrough UK,Middlesbrough test centre UK,medium,"address_incomplete,no_postcode_found",,,pending
mill_hill_london,Mill Hill London,,Great North Way,Mill Hill London driving test centre UK,Great North Way Mill Hill London UK,Mill Hill London test centre UK,medium,"address_incomplete,no_postcode_found",,,pending
mitcham_london,Mitcham London,,Mill green road,Mitcham London driving test centre UK,Mill green road Mitcham London UK,Mitcham London test centre UK,medium,"address_incomplete,no_postcode_found",,,pending
morden_london,Morden London,,Gander Green Lane,Morden London driving test centre UK,Gander Green Lane Morden London UK,Morden London test centre UK,medium,"address_incomplete,no_postcode_found",,,pending
nelson,Nelson,,Barden Lane / Greenhead Lane,Nelson driving test centre UK,Barden Lane / Greenhead Lane Nelson UK,Nelson test centre UK,medium,"address_incomplete,no_postcode_found",,,pending
newport_gwent,Newport Gwent,,Rupert Brooke Drive,Newport Gwent driving test centre UK,Rupert Brooke Drive Newport Gwent UK,Newport Gwent test centre UK,medium,"address_incomplete,no_postcode_found",,,pending
newton_abbot,Newton Abbot,,Ley Lane / Longford Lane,Newton Abbot driving test centre UK,Ley Lane / Longford Lane Newton Abbot UK,Newton Abbot test centre UK,medium,"address_incomplete,no_postcode_found",,,pending
newton_stewart,Newton Stewart,,New Galloway Rd,Newton Stewart driving test centre UK,New Galloway Rd Newton Stewart UK,Newton Stewart test centre UK,medium,"address_incomplete,no_postcode_found",,,pending
norris_green_liverpool,Norris Green Liverpool,,Utting Avenue East,Norris Green Liverpool driving test centre UK,Utting Avenue East Norris Green Liverpool UK,Norris Green Liverpool test centre UK,medium,"address_incomplete,no_postcode_found",,,pending
northallerton,Northallerton,,Mill Hill Lane,Northallerton driving test centre UK,Mill Hill Lane Northallerton UK,Northallerton test centre UK,medium,"address_incomplete,no_postcode_found",,,pending
northampton,Northampton,,St Peters Way,Northampton driving test centre UK,St Peters Way Northampton UK,Northampton test centre UK,medium,"address_incomplete,no_postcode_found",,,pending
norwich_jupiter_road,Norwich Jupiter Road,,Woodside Rd / Blue Boar Lane,Norwich Jupiter Road driving test centre UK,Woodside Rd / Blue Boar Lane Norwich Jupiter Road UK,Norwich Jupiter Road test centre UK,medium,"address_incomplete,no_postcode_found",,,pending
norwich_peachman_way,Norwich Peachman Way,,Woodside Rd / Blue Boar Lane,Norwich Peachman Way driving test centre UK,Woodside Rd / Blue Boar Lane Norwich Peachman Way UK,Norwich Peachman Way test centre UK,medium,"address_incomplete,no_postcode_found",,,pending
nottingham_colwick,Nottingham Colwick,,St Lukes Way,Nottingham Colwick driving test centre UK,St Lukes Way Nottingham Colwick UK,Nottingham Colwick test centre UK,medium,"address_incomplete,no_postcode_found",,,pending
nuneaton,Nuneaton,,St Davids Way,Nuneaton driving test centre UK,St Davids Way Nuneaton UK,Nuneaton test centre UK,medium,"address_incomplete,no_postcode_found",,,pending
oswestry,Oswestry,,Chestnut Ave / Cherry Tree Drive,Oswestry driving test centre UK,Chestnut Ave / Cherry Tree Drive Oswestry UK,Oswestry test centre UK,medium,"address_incomplete,no_postcode_found",,,pending
oxford_cowley,Oxford Cowley,,Cricket Rd / Rymers Lane,Oxford Cowley driving test centre UK,Cricket Rd / Rymers Lane Oxford Cowley UK,Oxford Cowley test centre UK,medium,"address_incomplete,no_postcode_found",,,pending
pembroke_dock,Pembroke Dock,,Buttermilk Lane / Myletts Hill,Pembroke Dock driving test centre UK,Buttermilk Lane / Myletts Hill Pembroke Dock UK,Pembroke Dock test centre UK,medium,"address_incomplete,no_postcode_found",,,pending
peterborough,Peterborough,,Paston Park Way,Peterborough driving test centre UK,Paston Park Way Peterborough UK,Peterborough test centre UK,medium,"address_incomplete,no_postcode_found",,,pending
pinner_london,Pinner London,,Elm Ave / Park way,Pinner London driving test centre UK,Elm Ave / Park way Pinner London UK,Pinner London test centre UK,medium,"address_incomplete,no_postcode_found",,,pending
plymouth,Plymouth,,Little Dock Lane,Plymouth driving test centre UK,Little Dock Lane Plymouth UK,Plymouth test centre UK,medium,"address_incomplete,no_postcode_found",,,pending
pontefract,Pontefract,,Jubilee Way / Mill Hill,Pontefract driving test centre UK,Jubilee Way / Mill Hill Pontefract UK,Pontefract test centre UK,medium,"address_incomplete,no_postcode_found",,,pending
poole,Poole,,Queen Anne Drive / Magna Rd,Poole driving test centre UK,Queen Anne Drive / Magna Rd Poole UK,Poole test centre UK,medium,"address_incomplete,no_postcode_found",,,pending
portsmouth,Portsmouth,,James Callaghan Drive,Portsmouth driving test centre UK,James Callaghan Drive Portsmouth UK,Portsmouth test centre UK,medium,"address_incomplete,no_postcode_found",,,pending
preston,Preston,,Chain Caul Way,Preston driving test centre UK,Chain Caul Way Preston UK,Preston test centre UK,medium,"address_incomplete,no_postcode_found",,,pending
pwllheli,Pwllheli,,Alaroad / Y Maes,Pwllheli driving test centre UK,Alaroad / Y Maes Pwllheli UK,Pwllheli test centre UK,medium,"address_incomplete,no_postcode_found",,,pending
reading,Reading,,Home Farm Close,Reading driving test centre UK,Home Farm Close Reading UK,Reading test centre UK,medium,"address_incomplete,no_postcode_found",,,pending
redditch,Redditch,,Rough Hill Drive,Redditch driving test centre UK,Rough Hill Drive Redditch UK,Redditch test centre UK,medium,"address_incomplete,no_postcode_found",,,pending
rochdale_manchester,Rochdale Manchester,,New Broad Lane,Rochdale Manchester driving test centre UK,New Broad Lane Rochdale Manchester UK,Rochdale Manchester test centre UK,medium,"address_incomplete,no_postcode_found",,,pending
rotherham,Rotherham,,Badsley Moor Lane,Rotherham driving test centre UK,Badsley Moor Lane Rotherham UK,Rotherham test centre UK,medium,"address_incomplete,no_postcode_found",,,pending
rugby,Rugby,,Newton Manor Lane,Rugby driving test centre UK,Newton Manor Lane Rugby UK,Rugby test centre UK,medium,"address_incomplete,no_postcode_found",,,pending
sale_manchester,Sale Manchester,,Bancroft Rd / Moss Lane,Sale Manchester driving test centre UK,Bancroft Rd / Moss Lane Sale Manchester UK,Sale Manchester test centre UK,medium,"address_incomplete,no_postcode_found",,,pending
scarborough,Scarborough,,Osgodby Lane / Church Lane,Scarborough driving test centre UK,Osgodby Lane / Church Lane Scarborough UK,Scarborough test centre UK,medium,"address_incomplete,no_postcode_found",,,pending
scunthorpe,Scunthorpe,,Crosby Grange Lane,Scunthorpe driving test centre UK,Crosby Grange Lane Scunthorpe UK,Scunthorpe test centre UK,medium,"address_incomplete,no_postcode_found",,,pending
sevenoaks,Sevenoaks,,Quakers Hall Lane,Sevenoaks driving test centre UK,Quakers Hall Lane Sevenoaks UK,Sevenoaks test centre UK,medium,"address_incomplete,no_postcode_found",,,pending
sheffield_handsworth,Sheffield Handsworth,,Richmond Park Avenue,Sheffield Handsworth driving test centre UK,Richmond Park Avenue Sheffield Handsworth UK,Sheffield Handsworth test centre UK,medium,"address_incomplete,no_postcode_found",,,pending
sheffield_middlewood_road,Sheffield Middlewood Road,,Catch Bar Lane,Sheffield Middlewood Road driving test centre UK,Catch Bar Lane Sheffield Middlewood Road UK,Sheffield Middlewood Road test centre UK,medium,"address_incomplete,no_postcode_found",,,pending
shrewsbury,Shrewsbury,,Featherbed Lane / The Parks,Shrewsbury driving test centre UK,Featherbed Lane / The Parks Shrewsbury UK,Shrewsbury test centre UK,medium,"address_incomplete,no_postcode_found",,,pending
sidcup_london,Sidcup London,,Rectory Lane / Bexley Lane,Sidcup London driving test centre UK,Rectory Lane / Bexley Lane Sidcup London UK,Sidcup London test centre UK,medium,"address_incomplete,no_postcode_found",,,pending
skegness,Skegness,,East End / Storeys Lane,Skegness driving test centre UK,East End / Storeys Lane Skegness UK,Skegness test centre UK,medium,"address_incomplete,no_postcode_found",,,pending
skipton,Skipton,,Bunkers Hill / Rectory Lane,Skipton driving test centre UK,Bunkers Hill / Rectory Lane Skipton UK,Skipton test centre UK,medium,"address_incomplete,no_postcode_found",,,pending
slough_london,Slough London,,Shaggy Calf Lane,Slough London driving test centre UK,Shaggy Calf Lane Slough London UK,Slough London test centre UK,medium,"address_incomplete,no_postcode_found",,,pending
south_shields,South Shields,,Coast Rd / Broadway,South Shields driving test centre UK,Coast Rd / Broadway South Shields UK,South Shields test centre UK,medium,"address_incomplete,no_postcode_found",,,pending
southall_london,Southall London,,Willow Tree Lane,Southall London driving test centre UK,Willow Tree Lane Southall London UK,Southall London test centre UK,medium,"address_incomplete,no_postcode_found",,,pending
southampton_forest_hills,Southampton Forest Hills,,Forest Hills Drive,Southampton Forest Hills driving test centre UK,Forest Hills Drive Southampton Forest Hills UK,Southampton Forest Hills test centre UK,medium,"address_incomplete,no_postcode_found",,,pending
southampton_maybush,Southampton Maybush,,Millbrook Rd / Mountbatten Way,Southampton Maybush driving test centre UK,Millbrook Rd / Mountbatten Way Southampton Maybush UK,Southampton Maybush test centre UK,medium,"address_incomplete,no_postcode_found",,,pending
southend_on_sea,Southend-On-Sea,,Thorpe Hall Avenue,Southend-On-Sea driving test centre UK,Thorpe Hall Avenue Southend-On-Sea UK,Southend-On-Sea test centre UK,medium,"address_incomplete,no_postcode_found",,,pending
southport_liverpool,Southport Liverpool,,Rufford Rd / Bankfield Lane,Southport Liverpool driving test centre UK,Rufford Rd / Bankfield Lane Southport Liverpool UK,Southport Liverpool test centre UK,medium,"address_incomplete,no_postcode_found",,,pending
speke_liverpool,Speke Liverpool,,Aigburth Hall Avenue Becomes,Speke Liverpool driving test centre UK,Aigburth Hall Avenue Becomes Speke Liverpool UK,Speke Liverpool test centre UK,medium,"address_incomplete,no_postcode_found",,,pending
st_albans,St Albans,,Colney Heath Lane,St Albans driving test centre UK,Colney Heath Lane St Albans UK,St Albans test centre UK,medium,"address_incomplete,no_postcode_found",,,pending
st_helens_liverpool,St Helens Liverpool,,Cowley Hill Lane,St Helens Liverpool driving test centre UK,Cowley Hill Lane St Helens Liverpool UK,St Helens Liverpool test centre UK,medium,"address_incomplete,no_postcode_found",,,pending
stafford,Stafford,,Lane until further notice,Stafford driving test centre UK,Lane until further notice Stafford UK,Stafford test centre UK,medium,"address_incomplete,no_postcode_found",,,pending
steeton,Steeton,,Spring Gardens Lane,Steeton driving test centre UK,Spring Gardens Lane Steeton UK,Steeton test centre UK,medium,"address_incomplete,no_postcode_found",,,pending
stevenage,Stevenage,,Six Hills Way,Stevenage driving test centre UK,Six Hills Way Stevenage UK,Stevenage test centre UK,medium,"address_incomplete,no_postcode_found",,,pending
stirling,Stirling,,Victoria Place / Queens Drive,Stirling driving test centre UK,Victoria Place / Queens Drive Stirling UK,Stirling test centre UK,medium,"address_incomplete,no_postcode_found",,,pending
stoke_on_trent_cobridge,Stoke-On-Trent Cobridge,,Reginald Mitchell Way,Stoke-On-Trent Cobridge driving test centre UK,Reginald Mitchell Way Stoke-On-Trent Cobridge UK,Stoke-On-Trent Cobridge test centre UK,medium,"address_incomplete,no_postcode_found",,,pending
stoke_on_trent_newcastle_under_lyme,Stoke-on-Trent Newcastle-Under-Lyme,,Clayton Lane/Stafford Avenue,Stoke-on-Trent Newcastle-Under-Lyme driving test centre UK,Clayton Lane/Stafford Avenue Stoke-on-Trent Newcastle-Under-Lyme UK,Stoke-on-Trent Newcastle-Under-Lyme test centre UK,medium,"address_incomplete,no_postcode_found",,,pending
sunderland,Sunderland,,Old Silksworth Lane,Sunderland driving test centre UK,Old Silksworth Lane Sunderland UK,Sunderland test centre UK,medium,"address_incomplete,no_postcode_found",,,pending
swansea,Swansea,,Valley Way Rd,Swansea driving test centre UK,Valley Way Rd Swansea UK,Swansea test centre UK,medium,"address_incomplete,no_postcode_found",,,pending
swindon,Swindon,,Broome Manor Lane / Carleton,Swindon driving test centre UK,Broome Manor Lane / Carleton Swindon UK,Swindon test centre UK,medium,"address_incomplete,no_postcode_found",,,pending
taunton,Taunton,,Burton Place / Middleway,Taunton driving test centre UK,Burton Place / Middleway Taunton UK,Taunton test centre UK,medium,"address_incomplete,no_postcode_found",,,pending
telford,Telford,,Donnington Wood Way,Telford driving test centre UK,Donnington Wood Way Telford UK,Telford test centre UK,medium,"address_incomplete,no_postcode_found",,,pending
thurso,Thurso,,Provost Cormack Drive,Thurso driving test centre UK,Provost Cormack Drive Thurso UK,Thurso test centre UK,medium,"address_incomplete,no_postcode_found",,,pending
tilbury,Tilbury,,King Edward Drive,Tilbury driving test centre UK,King Edward Drive Tilbury UK,Tilbury test centre UK,medium,"address_incomplete,no_postcode_found",,,pending
tolworth_london,Tolworth London,,Berrylands Rd / Manor Drive,Tolworth London driving test centre UK,Berrylands Rd / Manor Drive Tolworth London UK,Tolworth London test centre UK,medium,"address_incomplete,no_postcode_found",,,pending
tunbridge_wells,Tunbridge Wells,,Liptraps Lane / Birken Rd,Tunbridge Wells driving test centre UK,Liptraps Lane / Birken Rd Tunbridge Wells UK,Tunbridge Wells test centre UK,medium,"address_incomplete,no_postcode_found",,,pending
upton,Upton,,Arrowe Brook Lane,Upton driving test centre UK,Arrowe Brook Lane Upton UK,Upton test centre UK,medium,"address_incomplete,no_postcode_found",,,pending
uxbridge_london,Uxbridge London,,Cowley mill road,Uxbridge London driving test centre UK,Cowley mill road Uxbridge London UK,Uxbridge London test centre UK,medium,"address_incomplete,no_postcode_found",,,pending
wakefield,Wakefield,,Lime Pit Lane,Wakefield driving test centre UK,Lime Pit Lane Wakefield UK,Wakefield test centre UK,medium,"address_incomplete,no_postcode_found",,,pending
wanstead_london,Wanstead London,,South View Drive,Wanstead London driving test centre UK,South View Drive Wanstead London UK,Wanstead London test centre UK,medium,"address_incomplete,no_postcode_found",,,pending
warwick_wedgenock_house,Warwick Wedgenock House,,Field Barn Lane,Warwick Wedgenock House driving test centre UK,Field Barn Lane Warwick Wedgenock House UK,Warwick Wedgenock House test centre UK,medium,"address_incomplete,no_postcode_found",,,pending
watford,Watford,,Otterspool Way / Berrygrove Lane,Watford driving test centre UK,Otterspool Way / Berrygrove Lane Watford UK,Watford test centre UK,medium,"address_incomplete,no_postcode_found",,,pending
wednesbury,Wednesbury,,Dial Lane / Richmond St,Wednesbury driving test centre UK,Dial Lane / Richmond St Wednesbury UK,Wednesbury test centre UK,medium,"address_incomplete,no_postcode_found",,,pending
wellingborough,Wellingborough,,"Manoeuvre exercise first, drive forward into any parking bay and reverse out.",Wellingborough driving test centre UK,"Manoeuvre exercise first, drive forward into any parking bay and reverse out. Wellingborough UK",Wellingborough test centre UK,medium,"address_incomplete,no_postcode_found",,,pending
west_didsbury_manchester,West Didsbury Manchester,,Barlow Moor Road,West Didsbury Manchester driving test centre UK,Barlow Moor Road West Didsbury Manchester UK,West Didsbury Manchester test centre UK,medium,"address_incomplete,no_postcode_found",,,pending
west_wickham_london,West Wickham London,,Addington Rd / Bourne Way,West Wickham London driving test centre UK,Addington Rd / Bourne Way West Wickham London UK,West Wickham London test centre UK,medium,"address_incomplete,no_postcode_found",,,pending
widnes,Widnes,,Ashley Way West,Widnes driving test centre UK,Ashley Way West Widnes UK,Widnes test centre UK,medium,"address_incomplete,no_postcode_found",,,pending
winchester,Winchester,,Lower Stanmore Lane,Winchester driving test centre UK,Lower Stanmore Lane Winchester UK,Winchester test centre UK,medium,"address_incomplete,no_postcode_found",,,pending
wolverhampton,Wolverhampton,,Gt. Bricklin St / Aspen Way,Wolverhampton driving test centre UK,Gt. Bricklin St / Aspen Way Wolverhampton UK,Wolverhampton test centre UK,medium,"address_incomplete,no_postcode_found",,,pending
wood_green_london,Wood Green London,,White Hart Lane,Wood Green London driving test centre UK,White Hart Lane Wood Green London UK,Wood Green London test centre UK,medium,"address_incomplete,no_postcode_found",,,pending
worcester,Worcester,,Middle Hollow Drive,Worcester driving test centre UK,Middle Hollow Drive Worcester UK,Worcester test centre UK,medium,"address_incomplete,no_postcode_found",,,pending
workington,Workington,,Viaduct / Solway Rd lay-by,Workington driving test centre UK,Viaduct / Solway Rd lay-by Workington UK,Workington test centre UK,medium,"address_incomplete,no_postcode_found",,,pending
worksop,Worksop,,Sandy Lane / Babbage Way,Worksop driving test centre UK,Sandy Lane / Babbage Way Worksop UK,Worksop test centre UK,medium,"address_incomplete,no_postcode_found",,,pending
yeovil,Yeovil,,Wessex Rd / Eliotts Drive,Yeovil driving test centre UK,Wessex Rd / Eliotts Drive Yeovil UK,Yeovil test centre UK,medium,"address_incomplete,no_postcode_found",,,pending
york,York,,Murton Way / Osbaldwick Link Rd,York driving test centre UK,Murton Way / Osbaldwick Link Rd York UK,York test centre UK,medium,"address_incomplete,no_postcode_found",,,pending
