centre_id,centre_name,cleaned_postcode_candidate,cleaned_address_candidate,query_primary,query_secondary,query_tertiary,lookup_confidence,lookup_notes,lat,lng,resolution_status
aberdeen_north,Aberdeen North,,St Machar Drive,Aberdeen North driving test centre UK,St Machar Drive Aberdeen North UK,Aberdeen North test centre UK,medium,"address_incomplete,no_postcode_found",,,pending
abergavenny,Abergavenny,,Old Barn Way,Abergavenny driving test centre UK,Old Barn Way Abergavenny UK,Abergavenny test centre UK,medium,"address_incomplete,no_postcode_found",,,pending
alness,Alness,,Cromlet Drive / Academy Rd,Alness driving test centre UK,Cromlet Drive / Academy Rd Alness UK,Alness test centre UK,medium,"address_incomplete,no_postcode_found",,,pending
alnwick,Alnwick,,Tower Lane/Green Batt,Alnwick driving test centre UK,Tower Lane/Green Batt Alnwick UK,Alnwick test centre UK,medium,"address_incomplete,no_postcode_found",,,pending
ashfield,Ashfield,,New Lane / Beristowe Lane,Ashfield driving test centre UK,New Lane / Beristowe Lane Ashfield UK,Ashfield test centre UK,medium,"address_incomplete,no_postcode_found",,,pending
ashford_kent,Ashford Kent,,Tithe Barn Lane,Ashford Kent driving test centre UK,Tithe Barn Lane Ashford Kent UK,Ashford Kent test centre UK,medium,"address_incomplete,no_postcode_found",,,pending
aylesbury,Aylesbury,,Broughton Lane / Burcott lane,Aylesbury driving test centre UK,Broughton Lane / Burcott lane Aylesbury UK,Aylesbury test centre UK,medium,"address_incomplete,no_postcode_found",,,pending
ballater,Ballater,,Sir Patrick Geddies Way,Ballater driving test centre UK,Sir Patrick Geddies Way Ballater UK,Ballater test centre UK,medium,"address_incomplete,no_postcode_found",,,pending
banbury,Banbury,,Mewburn Rd / Queensway,Banbury driving test centre UK,Mewburn Rd / Queensway Banbury UK,Banbury test centre UK,medium,"address_incomplete,no_postcode_found",,,pending
barking_tanner_street,Barking Tanner Street,,South Park Drive,Barking Tanner Street driving test centre UK,South Park Drive Barking Tanner Street UK,Barking Tanner Street test centre UK,medium,"address_incomplete,no_postcode_found",,,pending
barnet_london,Barnet London,,Barnet Gate Lane / Mays Lane,Barnet London driving test centre UK,Barnet Gate Lane / Mays Lane Barnet London UK,Barnet London test centre UK,medium,"address_incomplete,no_postcode_found",,,pending
barnstaple,Barnstaple,,Westaway Hill / Old School Rd,Barnstaple driving test centre UK,Westaway Hill / Old School Rd Barnstaple UK,Barnstaple test centre UK,medium,"address_incomplete,no_postcode_found",,,pending
barrow_in_furness,Barrow In Furness,,James Freel Close,Barrow In Furness driving test centre UK,James Freel Close Barrow In Furness UK,Barrow In Furness test centre UK,medium,"address_incomplete,no_postcode_found",,,pending
basingstoke,Basingstoke,,Hatch Warren Way,Basingstoke driving test centre UK,Hatch Warren Way Basingstoke UK,Basingstoke test centre UK,medium,"address_incomplete,no_postcode_found",,,pending
bedford,Bedford,,Barkers Lane / Goldington Rd,Bedford driving test centre UK,Barkers Lane / Goldington Rd Bedford UK,Bedford test centre UK,medium,"address_incomplete,no_postcode_found",,,pending
belvedere_london,Belvedere London,,Harrow Manor Way,Belvedere London driving test centre UK,Harrow Manor Way Belvedere London UK,Belvedere London test centre UK,medium,"address_incomplete,no_postcode_found",,,pending
birmingham_garretts_green,Birmingham Garretts Green,,Garretts Green Lane,Birmingham Garretts Green driving test centre UK,Garretts Green Lane Birmingham Garretts Green UK,Birmingham Garretts Green test centre UK,medium,"address_incomplete,no_postcode_found",,,pending
birmingham_kings_heath,Birmingham Kings Heath,,Highters Heath Lane,Birmingham Kings Heath driving test centre UK,Highters Heath Lane Birmingham Kings Heath UK,Birmingham Kings Heath test centre UK,medium,"address_incomplete,no_postcode_found",,,pending
birmingham_kingstanding,Birmingham Kingstanding,,Doe Bank Lane,Birmingham Kingstanding driving test centre UK,Doe Bank Lane Birmingham Kingstanding UK,Birmingham Kingstanding test centre UK,medium,"address_incomplete,no_postcode_found",,,pending
birmingham_shirley,Birmingham Shirley,,Dog Kennel Lane,Birmingham Shirley driving test centre UK,Dog Kennel Lane Birmingham Shirley UK,Birmingham Shirley test centre UK,medium,"address_incomplete,no_postcode_found",,,pending
birmingham_south_yardley,Birmingham South Yardley,,The Avenue / Lincoln Rd,Birmingham South Yardley driving test centre UK,The Avenue / Lincoln Rd Birmingham South Yardley UK,Birmingham South Yardley test centre UK,medium,"address_incomplete,no_postcode_found",,,pending
birmingham_sutton_coldfield,Birmingham Sutton Coldfield,,Summer Rd / Gravelly Lane,Birmingham Sutton Coldfield driving test centre UK,Summer Rd / Gravelly Lane Birmingham Sutton Coldfield UK,Birmingham Sutton Coldfield test centre UK,medium,"address_incomplete,no_postcode_found",,,pending
bishops_stortford,Bishops Stortford,,The Street / Church Rd,Bishops Stortford driving test centre UK,The Street / Church Rd Bishops Stortford UK,Bishops Stortford test centre UK,medium,"address_incomplete,no_postcode_found",,,pending
blackburn_with_darwen,Blackburn with Darwen,,Barbara Castle Way,Blackburn with Darwen driving test centre UK,Barbara Castle Way Blackburn with Darwen UK,Blackburn with Darwen test centre UK,medium,"address_incomplete,no_postcode_found",,,pending
blackpool,Blackpool,,Newton Drive / Highcross Rd,Blackpool driving test centre UK,Newton Drive / Highcross Rd Blackpool UK,Blackpool test centre UK,medium,"address_incomplete,no_postcode_found",,,pending
bletchley,Bletchley,,Queensway / Brooklands Rd,Bletchley driving test centre UK,Queensway / Brooklands Rd Bletchley UK,Bletchley test centre UK,medium,"address_incomplete,no_postcode_found",,,pending
blyth,Blyth,,St Ronans Drive,Blyth driving test centre UK,St Ronans Drive Blyth UK,Blyth test centre UK,medium,"address_incomplete,no_postcode_found",,,pending
bodmin,Bodmin,,Plas Newydd Avenue,Bodmin driving test centre UK,Plas Newydd Avenue Bodmin UK,Bodmin test centre UK,medium,"address_incomplete,no_postcode_found",,,pending
bolton_manchester,Bolton Manchester,,Deane Church Lane,Bolton Manchester driving test centre UK,Deane Church Lane Bolton Manchester UK,Bolton Manchester test centre UK,medium,"address_incomplete,no_postcode_found",,,pending
boston,Boston,,John Adams Way,Boston driving test centre UK,John Adams Way Boston UK,Boston test centre UK,medium,"address_incomplete,no_postcode_found",,,pending
bradford_heaton,Bradford Heaton,,Walker Drive / Blythe Ave,Bradford Heaton driving test centre UK,Walker Drive / Blythe Ave Bradford Heaton UK,Bradford Heaton test centre UK,medium,"address_incomplete,no_postcode_found",,,pending
bradford_thornbury,Bradford Thornbury,,Broadway – becomes Horsforth New,Bradford Thornbury driving test centre UK,Broadway – becomes Horsforth New Bradford Thornbury UK,Bradford Thornbury test centre UK,medium,"address_incomplete,no_postcode_found",,,pending
brecon,Brecon,,Coryton Close / Bryn De Winton,Brecon driving test centre UK,Coryton Close / Bryn De Winton Brecon UK,Brecon test centre UK,medium,"address_incomplete,no_postcode_found",,,pending
bredbury_manchester,Bredbury Manchester,,Ashton Road - Start Independent Driving,Bredbury Manchester driving test centre UK,Ashton Road - Start Independent Driving Bredbury Manchester UK,Bredbury Manchester test centre UK,medium,"address_incomplete,no_postcode_found",,,pending
brentwood_london,Brentwood London,,Nags Head Lane,Brentwood London driving test centre UK,Nags Head Lane Brentwood London UK,Brentwood London test centre UK,medium,"address_incomplete,no_postcode_found",,,pending
bridgend,Bridgend,,Cefn Glas Lane,Bridgend driving test centre UK,Cefn Glas Lane Bridgend UK,Bridgend test centre UK,medium,"address_incomplete,no_postcode_found",,,pending
bridlington,Bridlington,,South Marine Drive,Bridlington driving test centre UK,South Marine Drive Bridlington UK,Bridlington test centre UK,medium,"address_incomplete,no_postcode_found",,,pending
bristol_brislington,Bristol Brislington,,Kensington Park Rd / Lodway Rd,Bristol Brislington driving test centre UK,Kensington Park Rd / Lodway Rd Bristol Brislington UK,Bristol Brislington test centre UK,medium,"address_incomplete,no_postcode_found",,,pending
burgess_hill,Burgess Hill,,Queen Elizabeth Avenue,Burgess Hill driving test centre UK,Queen Elizabeth Avenue Burgess Hill UK,Burgess Hill test centre UK,medium,"address_incomplete,no_postcode_found",,,pending
burton_on_trent,Burton on Trent,,Bosworth Drive / Charnwood Rd,Burton on Trent driving test centre UK,Bosworth Drive / Charnwood Rd Burton on Trent UK,Burton on Trent test centre UK,medium,"address_incomplete,no_postcode_found",,,pending
bury_st_edmunds,Bury St Edmunds,,Follow into one way system,Bury St Edmunds driving test centre UK,Follow into one way system Bury St Edmunds UK,Bury St Edmunds test centre UK,medium,"address_incomplete,postcode_invalid",,,pending
buxton,Buxton,,Green Lane Into,Buxton driving test centre UK,Green Lane Into Buxton UK,Buxton test centre UK,medium,"address_incomplete,no_postcode_found",,,pending
camborne,Camborne,,Dudnance Lane / Station Rd,Camborne driving test centre UK,Dudnance Lane / Station Rd Camborne UK,Camborne test centre UK,medium,"address_incomplete,no_postcode_found",,,pending
canterbury,Canterbury,,Oaten Hill / Upper Chantry Lane,Canterbury driving test centre UK,Oaten Hill / Upper Chantry Lane Canterbury UK,Canterbury test centre UK,medium,"address_incomplete,no_postcode_found",,,pending
carlisle,Carlisle,,Hopes Hill Drive,Carlisle driving test centre UK,Hopes Hill Drive Carlisle UK,Carlisle test centre UK,medium,"address_incomplete,no_postcode_found",,,pending
carmarthen,Carmarthen,,Richmond Terrace / Oak Lane,Carmarthen driving test centre UK,Richmond Terrace / Oak Lane Carmarthen UK,Carmarthen test centre UK,medium,"address_incomplete,no_postcode_found",,,pending
castle_douglas,Castle Douglas,,Gordon Drive / Brown Crescent,Castle Douglas driving test centre UK,Gordon Drive / Brown Crescent Castle Douglas UK,Castle Douglas test centre UK,medium,"address_incomplete,no_postcode_found",,,pending
cheetham_hill_manchester,Cheetham Hill Manchester,,Ashtree Rd / Crumpsall Lane,Cheetham Hill Manchester driving test centre UK,Ashtree Rd / Crumpsall Lane Cheetham Hill Manchester UK,Cheetham Hill Manchester test centre UK,medium,"address_incomplete,no_postcode_found",,,pending
chelmsford,Chelmsford,,Chelmer Village Way,Chelmsford driving test centre UK,Chelmer Village Way Chelmsford UK,Chelmsford test centre UK,medium,"address_incomplete,no_postcode_found",,,pending
cheltenham,Cheltenham,,Quat Goose Lane,Cheltenham driving test centre UK,Quat Goose Lane Cheltenham UK,Cheltenham test centre UK,medium,"address_incomplete,no_postcode_found",,,pending
chertsey_london,Chertsey London,,Renfree Way / High St,Chertsey London driving test centre UK,Renfree Way / High St Chertsey London UK,Chertsey London test centre UK,medium,"address_incomplete,no_postcode_found",,,pending
chesterfield,Chesterfield,,Water Meadon Lane,Chesterfield driving test centre UK,Water Meadon Lane Chesterfield UK,Chesterfield test centre UK,medium,"address_incomplete,no_postcode_found",,,pending
chingford_london,Chingford London,,Hatch Lane/New Rd,Chingford London driving test centre UK,Hatch Lane/New Rd Chingford London UK,Chingford London test centre UK,medium,"address_incomplete,no_postcode_found",,,pending
chippenham,Chippenham,,West Cepen Way,Chippenham driving test centre UK,West Cepen Way Chippenham UK,Chippenham test centre UK,medium,"address_incomplete,no_postcode_found",,,pending
chorley,Chorley,,Eaves Lane / Lyons Lane,Chorley driving test centre UK,Eaves Lane / Lyons Lane Chorley UK,Chorley test centre UK,medium,"address_incomplete,no_postcode_found",,,pending
clacton_on_sea,Clacton-on-Sea,,Leas Rd / Cherry Tree Avenue,Clacton-on-Sea driving test centre UK,Leas Rd / Cherry Tree Avenue Clacton-on-Sea UK,Clacton-on-Sea test centre UK,medium,"address_incomplete,no_postcode_found",,,pending
colchester,Colchester,,Walnut Tree Way / Iceni Way,Colchester driving test centre UK,Walnut Tree Way / Iceni Way Colchester UK,Colchester test centre UK,medium,"address_incomplete,no_postcode_found",,,pending
coventry,Coventry,,Bowling Green Lane,Coventry driving test centre UK,Bowling Green Lane Coventry UK,Coventry test centre UK,medium,"address_incomplete,no_postcode_found",,,pending
crawley,Crawley,,Haslett Avenue East,Crawley driving test centre UK,Haslett Avenue East Crawley UK,Crawley test centre UK,medium,"address_incomplete,no_postcode_found",,,pending
crewe,Crewe,,Queens Park Drive,Crewe driving test centre UK,Queens Park Drive Crewe UK,Crewe test centre UK,medium,"address_incomplete,no_postcode_found",,,pending
croydon_london,Croydon London,,Duppas Hill Lane,Croydon London driving test centre UK,Duppas Hill Lane Croydon London UK,Croydon London test centre UK,medium,"address_incomplete,no_postcode_found",,,pending
darlington,Darlington,,St Cuthberts Way,Darlington driving test centre UK,St Cuthberts Way Darlington UK,Darlington test centre UK,medium,"address_incomplete,no_postcode_found",,,pending
derby_alvaston,Derby Alvaston,,Burton Rd / Coles Lane,Derby Alvaston driving test centre UK,Burton Rd / Coles Lane Derby Alvaston UK,Derby Alvaston test centre UK,medium,"address_incomplete,no_postcode_found",,,pending
doncaster,Doncaster,,Sandal Park Drive,Doncaster driving test centre UK,Sandal Park Drive Doncaster UK,Doncaster test centre UK,medium,"address_incomplete,no_postcode_found",,,pending
dorchester,Dorchester,,Roman Rd / Apollo Close,Dorchester driving test centre UK,Roman Rd / Apollo Close Dorchester UK,Dorchester test centre UK,medium,"address_incomplete,no_postcode_found",,,pending
dumbarton,Dumbarton,,Dumbuck Rd / Underwood Drive,Dumbarton driving test centre UK,Dumbuck Rd / Underwood Drive Dumbarton UK,Dumbarton test centre UK,medium,"address_incomplete,no_postcode_found",,,pending
dumfries,Dumfries,,Oakfield Drive / Oakfield Brae,Dumfries driving test centre UK,Oakfield Drive / Oakfield Brae Dumfries UK,Dumfries test centre UK,medium,"address_incomplete,no_postcode_found",,,pending
dundee,Dundee,,Kinghorne Rd / Lawside Avenue,Dundee driving test centre UK,Kinghorne Rd / Lawside Avenue Dundee UK,Dundee test centre UK,medium,"address_incomplete,no_postcode_found",,,pending
dunfermline_vine,Dunfermline Vine,,Woodside Avenue / Middlebank St,Dunfermline Vine driving test centre UK,Woodside Avenue / Middlebank St Dunfermline Vine UK,Dunfermline Vine test centre UK,medium,"address_incomplete,no_postcode_found",,,pending
duns,Duns,,Berrywell Drive / Winterfield,Duns driving test centre UK,Berrywell Drive / Winterfield Duns UK,Duns test centre UK,medium,"address_incomplete,no_postcode_found",,,pending
durham,Durham,,Mill Lane / Shincliffe Lane,Durham driving test centre UK,Mill Lane / Shincliffe Lane Durham UK,Durham test centre UK,medium,"address_incomplete,no_postcode_found",,,pending
eastbourne,Eastbourne,,The Avenue / Upper Ave,Eastbourne driving test centre UK,The Avenue / Upper Ave Eastbourne UK,Eastbourne test centre UK,medium,"address_incomplete,no_postcode_found",,,pending
edinburgh_currie,Edinburgh Currie,,Baberton Mains Drive,Edinburgh Currie driving test centre UK,Baberton Mains Drive Edinburgh Currie UK,Edinburgh Currie test centre UK,medium,"address_incomplete,no_postcode_found",,,pending
elgin,Elgin,,Wards Rd / Wittet Drive,Elgin driving test centre UK,Wards Rd / Wittet Drive Elgin UK,Elgin test centre UK,medium,"address_incomplete,no_postcode_found",,,pending
elswick,Elswick,,William Armstrong Drive,Elswick driving test centre UK,William Armstrong Drive Elswick UK,Elswick test centre UK,medium,"address_incomplete,no_postcode_found",,,pending
exeter,Exeter,,Lane / Station Rd,Exeter driving test centre UK,Lane / Station Rd Exeter UK,Exeter test centre UK,medium,"address_incomplete,no_postcode_found",,,pending
folkestone,Folkestone,,Castle Hill Avenue,Folkestone driving test centre UK,Castle Hill Avenue Folkestone UK,Folkestone test centre UK,medium,"address_incomplete,no_postcode_found",,,pending
fraserburgh,Fraserburgh,,St Andrews Drive,Fraserburgh driving test centre UK,St Andrews Drive Fraserburgh UK,Fraserburgh test centre UK,medium,"address_incomplete,no_postcode_found",,,pending
gateshead,Gateshead,,Harlow Green Lane,Gateshead driving test centre UK,Harlow Green Lane Gateshead UK,Gateshead test centre UK,medium,"address_incomplete,no_postcode_found",,,pending
gillingham,Gillingham,,Hempstead Valley Drive,Gillingham driving test centre UK,Hempstead Valley Drive Gillingham UK,Gillingham test centre UK,medium,"address_incomplete,no_postcode_found",,,pending
glasgow_shieldhall,Glasgow Shieldhall,,Join Clydeside Expressway,Glasgow Shieldhall driving test centre UK,Join Clydeside Expressway Glasgow Shieldhall UK,Glasgow Shieldhall test centre UK,medium,"address_incomplete,no_postcode_found",,,pending
gloucester,Gloucester,,Holmleigh Drive / Windsor Drive,Gloucester driving test centre UK,Holmleigh Drive / Windsor Drive Gloucester UK,Gloucester test centre UK,medium,"address_incomplete,no_postcode_found",,,pending
goodmayes_london,Goodmayes London,,South Park Drive,Goodmayes London driving test centre UK,South Park Drive Goodmayes London UK,Goodmayes London test centre UK,medium,"address_incomplete,no_postcode_found",,,pending
grantham_somerby,Grantham Somerby,,Brook St / Broad St,Grantham Somerby driving test centre UK,Brook St / Broad St Grantham Somerby UK,Grantham Somerby test centre UK,medium,"address_incomplete,no_postcode_found",,,pending
greenford_horsenden_lane,Greenford Horsenden Lane,,Elms Lane / Perrine Rd,Greenford Horsenden Lane driving test centre UK,Elms Lane / Perrine Rd Greenford Horsenden Lane UK,Greenford Horsenden Lane test centre UK,medium,"address_incomplete,no_postcode_found",,,pending
greenock,Greenock,,Clarence St/Container Way,Greenock driving test centre UK,Clarence St/Container Way Greenock UK,Greenock test centre UK,medium,"address_incomplete,no_postcode_found",,,pending
grimsby_coldwater,Grimsby Coldwater,,Frederwick Ward Way,Grimsby Coldwater driving test centre UK,Frederwick Ward Way Grimsby Coldwater UK,Grimsby Coldwater test centre UK,medium,"address_incomplete,no_postcode_found",,,pending
guildford,Guildford,,Hook Hill Lane,Guildford driving test centre UK,Hook Hill Lane Guildford UK,Guildford test centre UK,medium,"address_incomplete,no_postcode_found",,,pending
haddington,Haddington,,Park Lane / Clerkington Rd,Haddington driving test centre UK,Park Lane / Clerkington Rd Haddington UK,Haddington test centre UK,medium,"address_incomplete,no_postcode_found",,,pending
halifax,Halifax,,Spring Hall Lane,Halifax driving test centre UK,Spring Hall Lane Halifax UK,Halifax test centre UK,medium,"address_incomplete,no_postcode_found",,,pending
hartlepool,Hartlepool,,Belle Vue Way,Hartlepool driving test centre UK,Belle Vue Way Hartlepool UK,Hartlepool test centre UK,medium,"address_incomplete,no_postcode_found",,,pending
hastings_ore,Hastings Ore,,Crowhurst Rd / Queensway,Hastings Ore driving test centre UK,Crowhurst Rd / Queensway Hastings Ore UK,Hastings Ore test centre UK,medium,"address_incomplete,no_postcode_found",,,pending
hawick,Hawick,,Hazelwood Rd / Roxburgh Drive,Hawick driving test centre UK,Hazelwood Rd / Roxburgh Drive Hawick UK,Hawick test centre UK,medium,"address_incomplete,no_postcode_found",,,pending
hereford,Hereford,,Old School Lane,Hereford driving test centre UK,Old School Lane Hereford UK,Hereford test centre UK,medium,"address_incomplete,no_postcode_found",,,pending
herne_bay,Herne Bay,,King Edward Avenue,Herne Bay driving test centre UK,King Edward Avenue Herne Bay UK,Herne Bay test centre UK,medium,"address_incomplete,no_postcode_found",,,pending
hexham,Hexham,,Queensway / Shaws Park,Hexham driving test centre UK,Queensway / Shaws Park Hexham UK,Hexham test centre UK,medium,"address_incomplete,no_postcode_found",,,pending
heysham,Heysham,,Hall Drive / Bare Lane,Heysham driving test centre UK,Hall Drive / Bare Lane Heysham UK,Heysham test centre UK,medium,"address_incomplete,no_postcode_found",,,pending
hinckley,Hinckley,,Tilton Rd/Azalea Drive,Hinckley driving test centre UK,Tilton Rd/Azalea Drive Hinckley UK,Hinckley test centre UK,medium,"address_incomplete,no_postcode_found",,,pending
hornchurch_london,Hornchurch London,,Squirrels Heath Lane,Hornchurch London driving test centre UK,Squirrels Heath Lane Hornchurch London UK,Hornchurch London test centre UK,medium,"address_incomplete,no_postcode_found",,,pending
horsforth,Horsforth,,West End Lane,Horsforth driving test centre UK,West End Lane Horsforth UK,Horsforth test centre UK,medium,"address_incomplete,no_postcode_found",,,pending
huddersfield,Huddersfield,,Park Drive South,Huddersfield driving test centre UK,Park Drive South Huddersfield UK,Huddersfield test centre UK,medium,"address_incomplete,no_postcode_found",,,pending
hull,Hull,,Air St / Sculcoates Lane,Hull driving test centre UK,Air St / Sculcoates Lane Hull UK,Hull test centre UK,medium,"address_incomplete,no_postcode_found",,,pending
huntly,Huntly,,Nelson St / Scott Drive,Huntly driving test centre UK,Nelson St / Scott Drive Huntly UK,Huntly test centre UK,medium,"address_incomplete,no_postcode_found",,,pending
hyde_manchester,Hyde Manchester,,Two Trees Lane,Hyde Manchester driving test centre UK,Two Trees Lane Hyde Manchester UK,Hyde Manchester test centre UK,medium,"address_incomplete,no_postcode_found",,,pending
islay_island,Islay Island,,Mary Mackays Lane,Islay Island driving test centre UK,Mary Mackays Lane Islay Island UK,Islay Island test centre UK,medium,"address_incomplete,no_postcode_found",,,pending
isles_of_scilly,Isles of Scilly,,Carn Friars Lane,Isles of Scilly driving test centre UK,Carn Friars Lane Isles of Scilly UK,Isles of Scilly test centre UK,medium,"address_incomplete,no_postcode_found",,,pending
isleworth_fleming_way,Isleworth Fleming Way,,Powder Mill Lane,Isleworth Fleming Way driving test centre UK,Powder Mill Lane Isleworth Fleming Way UK,Isleworth Fleming Way test centre UK,medium,"address_incomplete,no_postcode_found",,,pending
kendal_oxenholme_road,Kendal Oxenholme Road,,Sedburgh Rd / Castle Green Lane,Kendal Oxenholme Road driving test centre UK,Sedburgh Rd / Castle Green Lane Kendal Oxenholme Road UK,Kendal Oxenholme Road test centre UK,medium,"address_incomplete,no_postcode_found",,,pending
kettering,Kettering,,Linnet Drive / Barton Rd,Kettering driving test centre UK,Linnet Drive / Barton Rd Kettering UK,Kettering test centre UK,medium,"address_incomplete,no_postcode_found",,,pending
kings_lynn,Kings Lynn,,Edward Benefer Way / Low Rd,Kings Lynn driving test centre UK,Edward Benefer Way / Low Rd Kings Lynn UK,Kings Lynn test centre UK,medium,"address_incomplete,no_postcode_found",,,pending
kirkcaldy,Kirkcaldy,,Wester Bogie Road,Kirkcaldy driving test centre UK,Wester Bogie Road Kirkcaldy UK,Kirkcaldy test centre UK,medium,"address_incomplete,no_postcode_found",,,pending
lairg,Lairg,,Railway Car Park,Lairg driving test centre UK,Railway Car Park Lairg UK,Lairg test centre UK,medium,"address_incomplete,no_postcode_found",,,pending
lanark,Lanark,,Waterloo Drive / Wheatlandside,Lanark driving test centre UK,Waterloo Drive / Wheatlandside Lanark UK,Lanark test centre UK,medium,"address_incomplete,no_postcode_found",,,pending
launceston,Launceston,,Exeter St / Madford Lane,Launceston driving test centre UK,Exeter St / Madford Lane Launceston UK,Launceston test centre UK,medium,"address_incomplete,no_postcode_found",,,pending
leeds,Leeds,,Primrose Lane / Valley Drive,Leeds driving test centre UK,Primrose Lane / Valley Drive Leeds UK,Leeds test centre UK,medium,"address_incomplete,no_postcode_found",,,pending
leicester_cannock_street,Leicester Cannock Street,,Red Hill Way,Leicester Cannock Street driving test centre UK,Red Hill Way Leicester Cannock Street UK,Leicester Cannock Street test centre UK,medium,"address_incomplete,no_postcode_found",,,pending
leicester_wigston,Leicester Wigston,,Horsewell Lane / Launceston Rd,Leicester Wigston driving test centre UK,Horsewell Lane / Launceston Rd Leicester Wigston UK,Leicester Wigston test centre UK,medium,"address_incomplete,no_postcode_found",,,pending
leighton_buzzard_stanbridge_road,Leighton Buzzard Stanbridge Road,,St Leonards Close,Leighton Buzzard Stanbridge Road driving test centre UK,St Leonards Close Leighton Buzzard Stanbridge Road UK,Leighton Buzzard Stanbridge Road test centre UK,medium,"address_incomplete,no_postcode_found",,,pending
letchworth,Letchworth,,Norton Way North,Letchworth driving test centre UK,Norton Way North Letchworth UK,Letchworth test centre UK,medium,"address_incomplete,no_postcode_found",,,pending
lichfield,Lichfield,,Wood End Lane,Lichfield driving test centre UK,Wood End Lane Lichfield UK,Lichfield test centre UK,medium,"address_incomplete,no_postcode_found",,,pending
lincoln,Lincoln,,Outer Circle Drive,Lincoln driving test centre UK,Outer Circle Drive Lincoln UK,Lincoln test centre UK,medium,"address_incomplete,no_postcode_found",,,pending
llanelli,Llanelli,,Coleshill Terrace / Greenway St,Llanelli driving test centre UK,Coleshill Terrace / Greenway St Llanelli UK,Llanelli test centre UK,medium,"address_incomplete,no_postcode_found",,,pending
loughborough,Loughborough,,Craddock Drive / Spinney Drive,Loughborough driving test centre UK,Craddock Drive / Spinney Drive Loughborough UK,Loughborough test centre UK,medium,"address_incomplete,no_postcode_found",,,pending
lowestoft_mobbs_way,Lowestoft Mobbs Way,,The Street / Corton Rd,Lowestoft Mobbs Way driving test centre UK,The Street / Corton Rd Lowestoft Mobbs Way UK,Lowestoft Mobbs Way test centre UK,medium,"address_incomplete,no_postcode_found",,,pending
